{
  "generated_at": "2026-07-09",
  "source_review_generated_at": "2026-07-09",
  "summary": {
    "total": 52,
    "by_task_type": {
      "official_source_review": 17,
      "roadview_image_review": 17,
      "crowd_policy_review": 17,
      "category_refinement": 1
    },
    "by_priority": {
      "high": 34,
      "medium": 18
    },
    "by_status": {
      "open": 52
    }
  },
  "items": [
    {
      "task_id": "jeju_roadview_place_038_official_source_review",
      "card": {
        "id": "jeju_roadview_place_038",
        "name": "국립제주박물관",
        "region": "제주시",
        "category": "indoor",
        "verification_status": "partial"
      },
      "task_type": "official_source_review",
      "priority": "high",
      "status": "open",
      "required_evidence": [
        "official_or_public_accessibility_url",
        "operating_status",
        "accessible_toilet",
        "parking",
        "wheelchair_or_stroller_rental",
        "slope_or_stairs",
        "surface_condition"
      ],
      "source_queries": [
        "이지제주 국립제주박물관",
        "열린관광 모두의 여행 국립제주박물관",
        "국립제주박물관 공식 홈페이지 장애인 화장실 주차 휠체어"
      ],
      "image_samples": [],
      "recommended_action": "공식/공공 상세 출처 URL을 확인하고 접근성 필드별 근거를 기록"
    },
    {
      "task_id": "jeju_roadview_place_038_roadview_image_review",
      "card": {
        "id": "jeju_roadview_place_038",
        "name": "국립제주박물관",
        "region": "제주시",
        "category": "indoor",
        "verification_status": "partial"
      },
      "task_type": "roadview_image_review",
      "priority": "high",
      "status": "open",
      "required_evidence": [
        "entrance_step_or_ramp",
        "main_path_slope",
        "surface_condition",
        "parking_to_entrance_route"
      ],
      "source_queries": [],
      "image_samples": [
        "JEJUNATIONALMU-1-001",
        "JEJUNATIONALMU-1-002",
        "JEJUNATIONALMU-1-003"
      ],
      "image_count": 132,
      "captured_date_start": "2022-08-23",
      "captured_date_end": "2022-08-23",
      "recommended_action": "로드뷰 원본 이미지에서 경사·단차·바닥 상태와 주차장-출입구 연결 동선을 검수"
    },
    {
      "task_id": "jeju_roadview_place_038_crowd_policy_review",
      "card": {
        "id": "jeju_roadview_place_038",
        "name": "국립제주박물관",
        "region": "제주시",
        "category": "indoor",
        "verification_status": "partial"
      },
      "task_type": "crowd_policy_review",
      "priority": "medium",
      "status": "open",
      "required_evidence": [
        "weekday_weekend_crowd_policy",
        "seasonal_event_crowd_policy",
        "quiet_time_recommendation"
      ],
      "source_queries": [
        "국립제주박물관 운영시간 행사 혼잡",
        "국립제주박물관 단체관람 예약"
      ],
      "image_samples": [],
      "recommended_action": "혼잡 민감 사용자에게 표시할 혼잡도 정책과 회피 시간대를 정의"
    },
    {
      "task_id": "jeju_roadview_place_088_official_source_review",
      "card": {
        "id": "jeju_roadview_place_088",
        "name": "김녕미로공원",
        "region": "제주시",
        "category": "rest_area",
        "verification_status": "partial"
      },
      "task_type": "official_source_review",
      "priority": "high",
      "status": "open",
      "required_evidence": [
        "official_or_public_accessibility_url",
        "operating_status",
        "accessible_toilet",
        "parking",
        "wheelchair_or_stroller_rental",
        "slope_or_stairs",
        "surface_condition"
      ],
      "source_queries": [
        "이지제주 김녕미로공원",
        "열린관광 모두의 여행 김녕미로공원",
        "김녕미로공원 공식 홈페이지 장애인 화장실 주차 휠체어"
      ],
      "image_samples": [],
      "recommended_action": "공식/공공 상세 출처 URL을 확인하고 접근성 필드별 근거를 기록"
    },
    {
      "task_id": "jeju_roadview_place_088_roadview_image_review",
      "card": {
        "id": "jeju_roadview_place_088",
        "name": "김녕미로공원",
        "region": "제주시",
        "category": "rest_area",
        "verification_status": "partial"
      },
      "task_type": "roadview_image_review",
      "priority": "high",
      "status": "open",
      "required_evidence": [
        "entrance_step_or_ramp",
        "main_path_slope",
        "surface_condition",
        "parking_to_entrance_route"
      ],
      "source_queries": [],
      "image_samples": [
        "GIMNYEONGMAZEPA-1-001",
        "GIMNYEONGMAZEPA-1-002",
        "GIMNYEONGMAZEPA-1-003"
      ],
      "image_count": 15,
      "captured_date_start": "2022-09-26",
      "captured_date_end": "2022-09-26",
      "recommended_action": "로드뷰 원본 이미지에서 경사·단차·바닥 상태와 주차장-출입구 연결 동선을 검수"
    },
    {
      "task_id": "jeju_roadview_place_088_crowd_policy_review",
      "card": {
        "id": "jeju_roadview_place_088",
        "name": "김녕미로공원",
        "region": "제주시",
        "category": "rest_area",
        "verification_status": "partial"
      },
      "task_type": "crowd_policy_review",
      "priority": "medium",
      "status": "open",
      "required_evidence": [
        "weekday_weekend_crowd_policy",
        "seasonal_event_crowd_policy",
        "quiet_time_recommendation"
      ],
      "source_queries": [
        "김녕미로공원 운영시간 행사 혼잡",
        "김녕미로공원 단체관람 예약"
      ],
      "image_samples": [],
      "recommended_action": "혼잡 민감 사용자에게 표시할 혼잡도 정책과 회피 시간대를 정의"
    },
    {
      "task_id": "jeju_roadview_place_100_official_source_review",
      "card": {
        "id": "jeju_roadview_place_100",
        "name": "삼성혈",
        "region": "제주시",
        "category": "culture",
        "verification_status": "partial"
      },
      "task_type": "official_source_review",
      "priority": "high",
      "status": "open",
      "required_evidence": [
        "official_or_public_accessibility_url",
        "operating_status",
        "accessible_toilet",
        "parking",
        "wheelchair_or_stroller_rental",
        "slope_or_stairs",
        "surface_condition"
      ],
      "source_queries": [
        "이지제주 삼성혈",
        "열린관광 모두의 여행 삼성혈",
        "삼성혈 공식 홈페이지 장애인 화장실 주차 휠체어"
      ],
      "image_samples": [],
      "recommended_action": "공식/공공 상세 출처 URL을 확인하고 접근성 필드별 근거를 기록"
    },
    {
      "task_id": "jeju_roadview_place_100_roadview_image_review",
      "card": {
        "id": "jeju_roadview_place_100",
        "name": "삼성혈",
        "region": "제주시",
        "category": "culture",
        "verification_status": "partial"
      },
      "task_type": "roadview_image_review",
      "priority": "high",
      "status": "open",
      "required_evidence": [
        "entrance_step_or_ramp",
        "main_path_slope",
        "surface_condition",
        "parking_to_entrance_route"
      ],
      "source_queries": [],
      "image_samples": [
        "SAMSUNGHYEOL-1-001",
        "SAMSUNGHYEOL-1-002",
        "SAMSUNGHYEOL-1-003"
      ],
      "image_count": 52,
      "captured_date_start": "2022-09-29",
      "captured_date_end": "2022-09-29",
      "recommended_action": "로드뷰 원본 이미지에서 경사·단차·바닥 상태와 주차장-출입구 연결 동선을 검수"
    },
    {
      "task_id": "jeju_roadview_place_100_crowd_policy_review",
      "card": {
        "id": "jeju_roadview_place_100",
        "name": "삼성혈",
        "region": "제주시",
        "category": "culture",
        "verification_status": "partial"
      },
      "task_type": "crowd_policy_review",
      "priority": "medium",
      "status": "open",
      "required_evidence": [
        "weekday_weekend_crowd_policy",
        "seasonal_event_crowd_policy",
        "quiet_time_recommendation"
      ],
      "source_queries": [
        "삼성혈 운영시간 행사 혼잡",
        "삼성혈 단체관람 예약"
      ],
      "image_samples": [],
      "recommended_action": "혼잡 민감 사용자에게 표시할 혼잡도 정책과 회피 시간대를 정의"
    },
    {
      "task_id": "jeju_roadview_place_095_official_source_review",
      "card": {
        "id": "jeju_roadview_place_095",
        "name": "상효원수목원",
        "region": "서귀포시",
        "category": "forest",
        "verification_status": "partial"
      },
      "task_type": "official_source_review",
      "priority": "high",
      "status": "open",
      "required_evidence": [
        "official_or_public_accessibility_url",
        "operating_status",
        "accessible_toilet",
        "parking",
        "wheelchair_or_stroller_rental",
        "slope_or_stairs",
        "surface_condition"
      ],
      "source_queries": [
        "이지제주 상효원수목원",
        "열린관광 모두의 여행 상효원수목원",
        "상효원수목원 공식 홈페이지 장애인 화장실 주차 휠체어"
      ],
      "image_samples": [],
      "recommended_action": "공식/공공 상세 출처 URL을 확인하고 접근성 필드별 근거를 기록"
    },
    {
      "task_id": "jeju_roadview_place_095_roadview_image_review",
      "card": {
        "id": "jeju_roadview_place_095",
        "name": "상효원수목원",
        "region": "서귀포시",
        "category": "forest",
        "verification_status": "partial"
      },
      "task_type": "roadview_image_review",
      "priority": "high",
      "status": "open",
      "required_evidence": [
        "entrance_step_or_ramp",
        "main_path_slope",
        "surface_condition",
        "parking_to_entrance_route"
      ],
      "source_queries": [],
      "image_samples": [
        "SANGHYO-1-001",
        "SANGHYO-1-002",
        "SANGHYO-1-003"
      ],
      "image_count": 73,
      "captured_date_start": "2022-09-28",
      "captured_date_end": "2022-09-28",
      "recommended_action": "로드뷰 원본 이미지에서 경사·단차·바닥 상태와 주차장-출입구 연결 동선을 검수"
    },
    {
      "task_id": "jeju_roadview_place_095_crowd_policy_review",
      "card": {
        "id": "jeju_roadview_place_095",
        "name": "상효원수목원",
        "region": "서귀포시",
        "category": "forest",
        "verification_status": "partial"
      },
      "task_type": "crowd_policy_review",
      "priority": "medium",
      "status": "open",
      "required_evidence": [
        "weekday_weekend_crowd_policy",
        "seasonal_event_crowd_policy",
        "quiet_time_recommendation"
      ],
      "source_queries": [
        "상효원수목원 운영시간 행사 혼잡",
        "상효원수목원 단체관람 예약"
      ],
      "image_samples": [],
      "recommended_action": "혼잡 민감 사용자에게 표시할 혼잡도 정책과 회피 시간대를 정의"
    },
    {